{
  "schema_version": "1.0",
  "scraper_id": "collector-sp-01",
  "shop_id": "mambo",
  "run_id": "11111111-1111-4111-8111-111111111111",
  "scraper_name": "Mambo",
  "started_at": "2026-11-01T09:00:00-03:00",
  "finished_at": "2026-11-01T09:01:00-03:00",
  "observations": 20,
  "errors": 0,
  "warnings": 1,
  "omitted": 0,
  "diagnostics": [
    {
      "severity": "warning",
      "category": "collection",
      "message": "target=coffee: package size could not be extracted"
    }
  ]
}
